{
  "schemaVersion": "1.0.0",
  "status": "STOPPED_PARTIAL",
  "governing": false,
  "environment": "development",
  "phase": "create_unbound_storage_and_queue",
  "recordedAt": "2026-08-18T17:31:50Z",
  "sourcePacket": {
    "path": "deployment/development-resource-creation-packet.json",
    "sha256": "a3dd1fe2657818a068bdb1095df82eeed00af8642d412b65b2e6b1aad5720f0a",
    "reviewedHead": "604604473cadf68a7f26732b45314c2c8af288d2",
    "mergeCommit": "fd5f218158f57bf4efd18d01466e20a743abe5d4"
  },
  "ownerAuthorization": {
    "received": true,
    "accountName": "smartsitecapture.com",
    "accountId": "de5e0273347b0b4c5f8f4e554aa2288f",
    "scope": "create_exact_empty_unbound_d1_and_exact_unconnected_queue_only"
  },
  "authorityDatabase": {
    "operation": "create",
    "outcome": "CREATED",
    "name": "8978-ai-authority-dev",
    "databaseId": "741ade94-8539-4fc8-b6be-24884720dee8",
    "createdAt": "2026-08-18T17:17:23.103Z",
    "requestedLocationPolicy": "cloudflare_automatic",
    "actualRegion": "WNAM",
    "jurisdiction": null,
    "readReplication": "disabled",
    "numTables": 0,
    "fileSizeBytes": 12288,
    "sqlExecuted": false,
    "migrationsApplied": false,
    "dataInserted": false,
    "bindingInstalled": false,
    "bindingVerification": {
      "status": "INFERRED_UNBOUND",
      "basis": "all_eight_workers_predate_database_creation",
      "latestWorkerModifiedAt": "2026-08-11T16:43:02Z"
    }
  },
  "locationDeviation": {
    "detected": true,
    "expected": "cloudflare_automatic",
    "actual": "WNAM",
    "operationalAssessment": "ACCEPTABLE",
    "ownerAccepted": false,
    "deleteAuthorized": false,
    "automaticCleanupAuthorized": false
  },
  "queue": {
    "operation": "create",
    "outcome": "NOT_ATTEMPTED",
    "name": "8978-ai-orchestrator-dev",
    "expectedDeliveryDelaySeconds": 0,
    "expectedMessageRetentionSeconds": 86400,
    "postStopExistence": "UNVERIFIED",
    "bindingInstalled": false,
    "producerAdded": false,
    "consumerAdded": false,
    "messagePublished": false
  },
  "workflow": {
    "outcome": "NOT_ATTEMPTED",
    "workerOrWorkflowChanged": false
  },
  "externalEffects": {
    "workerDeployed": false,
    "configurationChanged": false,
    "routeChanged": false,
    "secretOrKeyChanged": false,
    "activationPerformed": false,
    "automaticRetryPerformed": false,
    "automaticCleanupPerformed": false
  },
  "continuation": {
    "authorized": false,
    "requiredDecision": "owner_accepts_wnam_deviation_and_separately_authorizes_queue_resume",
    "nextPermittedRepositoryAction": "independent_review_of_this_code_only_record"
  },
  "verification": {
    "method": "cloudflare_api_read_only",
    "checkerVerdict": "CLAUDE READ-ONLY VERIFICATION: PR #24 D1 CREATION ACCEPTABLE WITH WNAM DEVIATION",
    "limitations": [
      "D1 analytics were not available to the checker",
      "Worker bindings were inferred from deployment timestamps rather than directly enumerated",
      "Queue state was not available to the checker"
    ]
  }
}
